{
  "as_of": "2026-08-29",
  "federation_digest": "7de7c2dda23db2581294176bb262ae4aa8cbdc4ba97cdd4326278e88a9713a05",
  "owner": "Shtenco",
  "policy": {
    "ai_accounting_authority": "NONE",
    "ai_blockchain_submission_authority": "NONE",
    "ai_financial_authority": "NONE",
    "ai_payment_authority": "NONE",
    "ai_production_deployment_authority": "NONE",
    "auto_merge": false,
    "historical_evidence_preserved": true,
    "internal_mint_or_revaluation_is_external_profit": false,
    "merge_authority": "HUMAN_MAINTAINER_ONLY",
    "status_promotion_requires_executed_evidence": true
  },
  "repositories": [
    {
      "authority": "NONE",
      "classification": "CANONICAL_ROOT",
      "maturity": "ACTIVE_CANDIDATE",
      "next_milestone": "Federation v2 + Economic OS convergence",
      "portfolio_cluster": "architecture-governance",
      "repository": "Shtenco/synergy_system",
      "role": "Architecture constitution, repository federation, authority boundaries",
      "top20_steps": [1, 2, 5, 6, 20]
    },
    {
      "authority": "FINANCIAL_ACCOUNTING",
      "classification": "CANONICAL_DOMAIN",
      "maturity": "ACTIVE_CANDIDATE",
      "next_milestone": "Deployable reference service + live-cycle evidence",
      "portfolio_cluster": "financial-core",
      "repository": "Shtenco/synergy_financial_os",
      "role": "Double-entry ledger, revenue recognition, HardNAV, liquidity, distribution capacity",
      "top20_steps": [2, 3, 5, 6, 8]
    },
    {
      "authority": "SETTLEMENT",
      "classification": "CANONICAL_DOMAIN",
      "maturity": "WORKING_REFERENCE_PRELIVE",
      "next_milestone": "Real provider corridor + independent settlement evidence",
      "portfolio_cluster": "payments",
      "repository": "Shtenco/synergy_pay_system",
      "role": "MetaPay fiat/crypto/CBDC routing, settlement and reconciliation",
      "top20_steps": [3, 5, 6, 7]
    },
    {
      "authority": "TRUST_COMMITMENT",
      "classification": "CANONICAL_DOMAIN",
      "maturity": "LOCAL_TESTNET_EVIDENCE",
      "next_milestone": "External 3-host testnet evidence",
      "portfolio_cluster": "trust-blockchain",
      "repository": "Shtenco/synergy_ai_blockchain",
      "role": "Trust commitments, checkpoint/testnet and PQ blockchain R&D",
      "top20_steps": [4, 5, 6, 17]
    },
    {
      "authority": "NETWORK_TRANSPORT",
      "classification": "CANONICAL_DOMAIN",
      "maturity": "R&D_BOOTSTRAP",
      "next_milestone": "3-10 node benchmarked transport testbed",
      "portfolio_cluster": "network",
      "repository": "Shtenco/synergynet",
      "role": "P2P content-addressed deduplicated network",
      "top20_steps": [5, 6, 14]
    },
    {
      "authority": "RUNTIME_ORCHESTRATION",
      "classification": "CANONICAL_DOMAIN",
      "maturity": "PREPRODUCTION_EVIDENCE",
      "next_milestone": "Persistent external node deployment",
      "portfolio_cluster": "runtime-os",
      "repository": "Shtenco/synergy_meta_os",
      "role": "Node/service orchestration with capability boundaries",
      "top20_steps": [4, 5, 6, 15]
    },
    {
      "authority": "HOST_EXECUTION",
      "classification": "ACTIVE_R&D",
      "maturity": "KERNEL_R&D",
      "next_milestone": "Close VM/guest/hardware evidence and stable host profile",
      "portfolio_cluster": "host-os",
      "repository": "Shtenco/turbo_linux",
      "role": "Host/kernel/capability/IPC/VM substrate",
      "top20_steps": [6, 16]
    },
    {
      "authority": "AI_INFERENCE",
      "classification": "CANONICAL_TARGET",
      "maturity": "BOOTSTRAP",
      "next_milestone": "Migrate strongest reproducible NEXUS generation with frozen benchmark",
      "portfolio_cluster": "ai-core",
      "repository": "Shtenco/agi_nexus",
      "role": "Canonical validated NEXUS model/runtime target",
      "top20_steps": [5, 6, 11]
    },
    {
      "authority": "RESEARCH_ONLY",
      "classification": "ACTIVE_R&D_SOURCE",
      "maturity": "ADVANCED_R&D",
      "next_milestone": "Reproduce and promote validated components into agi_nexus",
      "portfolio_cluster": "ai-research",
      "repository": "Shtenco/agi_olga",
      "role": "SmallWorld AGI, ARC DSL, NEXUS-600K and OLGA research lineage",
      "top20_steps": [6, 11, 20]
    },
    {
      "authority": "AI_PROPOSAL_ONLY",
      "classification": "CANONICAL_PRODUCT_CANDIDATE",
      "maturity": "PREPRODUCTION_EVIDENCE",
      "next_milestone": "Persistent sandbox deployment with bounded business actions",
      "portfolio_cluster": "ai-autopilot",
      "repository": "Shtenco/agi_autopilot",
      "role": "Bounded NEXUS business/SMM/autopilot node",
      "top20_steps": [6, 12]
    },
    {
      "authority": "RESEARCH_ORCHESTRATION",
      "classification": "CANONICAL_TARGET",
      "maturity": "BOOTSTRAP",
      "next_milestone": "Reproducible evidence-agent pipeline over scientific repos",
      "portfolio_cluster": "science-ai",
      "repository": "Shtenco/nexus_science_agent",
      "role": "Scientific search, evidence graph, falsification and research orchestration",
      "top20_steps": [6, 19, 20]
    },
    {
      "authority": "PRESENTATION_CONTROL",
      "classification": "PRODUCT",
      "maturity": "WORKING_SOURCE",
      "next_milestone": "Metered SaaS backend, tenants, billing and audit integration",
      "portfolio_cluster": "business-os",
      "repository": "Shtenco/synergychain",
      "role": "Growth OS, OLGA chat, AI SMM/CRM/Sales/CFO control plane",
      "top20_steps": [5, 6, 9]
    },
    {
      "authority": "PRESENTATION_ONLY",
      "classification": "PRESENTATION",
      "maturity": "PUBLIC_PRESENTATION",
      "next_milestone": "Unify product/IR architecture and live status dashboard",
      "portfolio_cluster": "public-portal",
      "repository": "Shtenco/synergychain.github.io",
      "role": "Public static portal/deployment",
      "top20_steps": [6, 20]
    },
    {
      "authority": "CLIENT_ONLY",
      "classification": "PRODUCT",
      "maturity": "STORE_RELEASE_READY",
      "next_milestone": "Production backend integration, analytics and paid conversion",
      "portfolio_cluster": "finance-app",
      "repository": "Shtenco/synergy_app",
      "role": "SINERGY Finance Android/iOS store release lineage",
      "top20_steps": [5, 6, 10]
    },
    {
      "authority": "CLIENT_NODE",
      "classification": "PRODUCT_R&D",
      "maturity": "MOBILE_R&D",
      "next_milestone": "Unify identity, wallet/read-only trust and backend services",
      "portfolio_cluster": "super-app",
      "repository": "Shtenco/sinergy-super-app",
      "role": "Mobile/super-app and native node lineage",
      "top20_steps": [5, 6, 10, 15]
    },
    {
      "authority": "NONE",
      "classification": "PLACEHOLDER",
      "maturity": "EMPTY",
      "next_milestone": "Declare redirect/archive policy without deleting provenance",
      "portfolio_cluster": "empty-old-app",
      "repository": "Shtenco/sinergy_app",
      "role": "Empty/old application target",
      "top20_steps": [6, 20]
    },
    {
      "authority": "DOMAIN_EVIDENCE",
      "classification": "CANONICAL_DOMAIN",
      "maturity": "R&D_DOMAIN",
      "next_milestone": "Turn model into deterministic household capital engine/API",
      "portfolio_cluster": "household-finance",
      "repository": "Shtenco/synergy_matrix_sota",
      "role": "Savings, maturity ladder and mutual credit modelling",
      "top20_steps": [5, 6, 8, 10]
    },
    {
      "authority": "DOMAIN_EVIDENCE",
      "classification": "CANONICAL_DOMAIN",
      "maturity": "R&D_DOMAIN",
      "next_milestone": "Project cash-flow/evidence API feeding Financial OS screening",
      "portfolio_cluster": "real-economy",
      "repository": "Shtenco/synergy_eurasian",
      "role": "Productive projects and Eurasian economic/resource model",
      "top20_steps": [5, 6, 8]
    },
    {
      "authority": "PUBLIC_TRACE_EVIDENCE",
      "classification": "PRODUCT_CANDIDATE",
      "maturity": "WORKING_R&D",
      "next_milestone": "Real-data pilot package and deployable audit dashboard",
      "portfolio_cluster": "public-sector-os",
      "repository": "Shtenco/blochain_budget",
      "role": "Public budget/procurement traceability and Merkle evidence engine",
      "top20_steps": [6, 18]
    },
    {
      "authority": "RESEARCH_ONLY",
      "classification": "R&D_LAB",
      "maturity": "ACTIVE_R&D",
      "next_milestone": "Formal falsification corpus + safe handoff of proven components",
      "portfolio_cluster": "financial-rnd",
      "repository": "Shtenco/ai_financial_system",
      "role": "QE/QT, AMM, arbitrage, flash loans, market-making research",
      "top20_steps": [2, 6, 13, 20]
    },
    {
      "authority": "RESEARCH_ONLY",
      "classification": "R&D_LAB",
      "maturity": "R&D",
      "next_milestone": "Adversarial solvency and external-value benchmark",
      "portfolio_cluster": "monetary-rnd",
      "repository": "Shtenco/usds",
      "role": "Stable-money monetary experiment",
      "top20_steps": [2, 6, 20]
    },
    {
      "authority": "NONE",
      "classification": "LEGACY_SOURCE",
      "maturity": "LEGACY",
      "next_milestone": "Freeze provenance; extract only independently validated mechanisms",
      "portfolio_cluster": "legacy-tokenomics",
      "repository": "Shtenco/cashero",
      "role": "Historical cyclic liquidity/tokenomics lineage",
      "top20_steps": [6, 20]
    },
    {
      "authority": "AI_TRADING_PROPOSAL",
      "classification": "CANONICAL_TARGET",
      "maturity": "BOOTSTRAP",
      "next_milestone": "Consolidate validated strategies and risk/decision artifacts",
      "portfolio_cluster": "canonical-trading",
      "repository": "Shtenco/midas_ai",
      "role": "Canonical MIDAS bounded investment/trading intelligence",
      "top20_steps": [5, 6, 13]
    },
    {
      "authority": "TRADING_R&D",
      "classification": "ACTIVE_R&D_SOURCE",
      "maturity": "WORKING_R&D",